{
  "$schema":"https://json-schema.org/draft/2020-12/schema",
  "$id":"urn:chatgnt:schema:evaluation-protocol:v1",
  "type":"object",
  "additionalProperties":false,
  "required":["schema_version","protocol_id","status","protocol_schema_path","protocol_manifest_path","evaluation_generation_manifest_schema_path","review_artifact_schema_path","freeze_gate","documentation_paths","heldout_prompt_schema_path","prompt_overlap_review_schema_path","response_similarity_review_schema_path","response_similarity_evidence_schema_path","source_identity_schema_path","withheld_domain_check_schema_path","heldout_freeze_bundle_schema_path","stage5_semantic_review_schema_path","stage3_verification_evidence_schema_path","qualitative_judgment_schema_path","pairwise_judgment_schema_path","heldout_replacement_schema_path","qualitative_rubric_path","judge_manifest_path","judge_calibration_path","contamination_calibration_path","response_similarity_calibration_path","sample","withheld_domains","contamination","judging","pairwise","measurement","response_similarity","authoring"],
  "properties": {
    "schema_version":{"const":1},
    "protocol_id":{"const":"chatgnt-evaluation-v1"},
    "status":{"enum":["review_candidate","frozen"]},
    "protocol_schema_path":{"const":"schemas/evaluation-protocol-v1.schema.json"},
    "protocol_manifest_path":{"const":"config/evaluation-protocol-manifest-v1.json"},
    "evaluation_generation_manifest_schema_path":{"const":"schemas/evaluation-generation-manifest-v1.schema.json"},
    "review_artifact_schema_path":{"const":"schemas/stage3-review-artifact-v1.schema.json"},
    "freeze_gate":{
      "type":"object","additionalProperties":false,
      "required":["independent_review_required","review_id","reviewer_identity","review_verdict","unresolved_blocking_findings","frozen_at_utc","review_artifact_path","review_artifact_sha256","verification_evidence_path","verification_evidence_sha256","transition_orchestrator_sha256"],
      "properties":{
        "independent_review_required":{"const":true},
        "review_id":{"type":["string","null"]},
        "reviewer_identity":{"type":["string","null"]},
        "review_verdict":{"enum":["pass",null]},
        "unresolved_blocking_findings":{"type":["integer","null"],"minimum":0},
        "frozen_at_utc":{"type":["string","null"]},
        "review_artifact_path":{"type":["string","null"]},
        "review_artifact_sha256":{"type":["string","null"],"pattern":"^[0-9a-f]{64}$"},
        "verification_evidence_path":{"type":["string","null"]},
        "verification_evidence_sha256":{"type":["string","null"],"pattern":"^[0-9a-f]{64}$"},
        "transition_orchestrator_sha256":{"type":["string","null"],"pattern":"^[0-9a-f]{64}$"}
      }
    },
    "documentation_paths":{"type":"array","minItems":9,"uniqueItems":true,"items":{"type":"string","pattern":"^docs/.+\\.md$"}},
    "heldout_prompt_schema_path":{"const":"schemas/heldout-prompt-v1.schema.json"},
    "prompt_overlap_review_schema_path":{"const":"schemas/prompt-overlap-review-v1.schema.json"},
    "response_similarity_review_schema_path":{"const":"schemas/response-similarity-review-v1.schema.json"},
    "response_similarity_evidence_schema_path":{"const":"schemas/response-similarity-evidence-v1.schema.json"},
    "source_identity_schema_path":{"const":"schemas/source-identity-v1.schema.json"},
    "withheld_domain_check_schema_path":{"const":"schemas/withheld-domain-check-v1.schema.json"},
    "heldout_freeze_bundle_schema_path":{"const":"schemas/heldout-freeze-bundle-v1.schema.json"},
    "stage5_semantic_review_schema_path":{"const":"schemas/stage5-semantic-review-v1.schema.json"},
    "stage3_verification_evidence_schema_path":{"const":"schemas/stage3-verification-evidence-v1.schema.json"},
    "qualitative_judgment_schema_path":{"const":"schemas/qualitative-judgment-v1.schema.json"},
    "pairwise_judgment_schema_path":{"const":"schemas/pairwise-judgment-v1.schema.json"},
    "heldout_replacement_schema_path":{"const":"schemas/heldout-replacement-v1.schema.json"},
    "qualitative_rubric_path":{"const":"config/evaluation-rubric-v1.json"},
    "judge_manifest_path":{"const":"config/judge-manifest-v1.json"},
    "judge_calibration_path":{"const":"data/evaluation/judge-calibration-v1.jsonl"},
    "contamination_calibration_path":{"const":"data/evaluation/contamination-calibration-v1.jsonl"},
    "response_similarity_calibration_path":{"const":"data/evaluation/response-similarity-calibration-v1.jsonl"},
    "sample":{"type":"object","additionalProperties":false,"required":["prompt_count","intent_family_each","reporting_slices","input_forms","complexity","composed_per_intent_family","composed_robustness","composed_non_robustness_per_intent_family","constraint_bearing","constraint_bearing_per_intent_family","robustness_roles"],"properties":{"prompt_count":{"const":60},"intent_family_each":{"const":12},"reporting_slices":{"const":{"target_use":30,"cross_domain":15,"robustness":15}},"input_forms":{"const":{"question":15,"direct_request_or_command":30,"statement_or_fragment":15}},"complexity":{"const":{"standard":40,"composed":20}},"composed_per_intent_family":{"const":4},"composed_robustness":{"const":15},"composed_non_robustness_per_intent_family":{"const":1},"constraint_bearing":{"const":10},"constraint_bearing_per_intent_family":{"const":2},"robustness_roles":{"const":{"format_pressure":5,"behaviour_pressure":5,"serialization_pressure":5}}}},
    "withheld_domains":{"type":"object","additionalProperties":false,"required":["domains","prompts_per_domain","prompts_per_intent_family_domain_pair","prohibited_project_collections"],"properties":{"domains":{},"prompts_per_domain":{},"prompts_per_intent_family_domain_pair":{},"prohibited_project_collections":{}}},
    "contamination":{"type":"object","additionalProperties":false,"required":["source_collections","normalization","exact_normalized_match_action","lexical","semantic","metadata","semantic_review_questions","reject_when","review"],"properties":{"source_collections":{},"normalization":{},"exact_normalized_match_action":{},"lexical":{"type":"object","additionalProperties":false,"required":["library","version","algorithm","top_k","license"],"properties":{"library":{},"version":{},"algorithm":{},"top_k":{},"license":{}}},"semantic":{"type":"object","additionalProperties":false,"required":["model_id","revision","license","dimensions","maximum_wordpieces","pooling","normalization","similarity","top_k","record_pre_truncation_wordpieces","record_truncation_flag","truncated_input_action"],"properties":{"model_id":{},"revision":{},"license":{},"dimensions":{},"maximum_wordpieces":{},"pooling":{},"normalization":{},"similarity":{},"top_k":{},"record_pre_truncation_wordpieces":{},"record_truncation_flag":{},"truncated_input_action":{}}},"metadata":{"type":"object","additionalProperties":false,"required":["fields","top_k"],"properties":{"fields":{},"top_k":{}}},"semantic_review_questions":{},"reject_when":{},"review":{"type":"object","additionalProperties":false,"required":["second_review_for","accepted_audit_fraction","accepted_audit_selection","second_reviewer_blind_to_first_decision","unresolved_action","retain_all_rationales"],"properties":{"second_review_for":{},"accepted_audit_fraction":{},"accepted_audit_selection":{},"second_reviewer_blind_to_first_decision":{},"unresolved_action":{},"retain_all_rationales":{}}}}},
    "judging":{"type":"object","additionalProperties":false,"required":["qualitative_eligibility","primary_llm_judgments_per_eligible_response","human_calibration_response_count","human_calibration_response_allocation","human_calibration_response_ordering","human_calibration_pair_count","human_calibration_selection_seed","llm_unable_to_assess_action","second_unable_to_assess_action","human_and_llm_results_reported_separately","agreement_statistics","no_automatic_agreement_threshold"],"properties":{"qualitative_eligibility":{},"primary_llm_judgments_per_eligible_response":{},"human_calibration_response_count":{},"human_calibration_response_allocation":{},"human_calibration_response_ordering":{},"human_calibration_pair_count":{},"human_calibration_selection_seed":{},"llm_unable_to_assess_action":{},"second_unable_to_assess_action":{},"human_and_llm_results_reported_separately":{},"agreement_statistics":{},"no_automatic_agreement_threshold":{}}},
    "pairwise":{"type":"object","additionalProperties":false,"required":["primary_systems","conditional_eligibility","primary_llm_judgments_per_eligible_pair","order_seed","order_algorithm","order_balance","choices","unable_to_assess_action","human_calibration_pair_count","human_calibration_pair_allocation","human_calibration_pair_ordering","both_invalid_outcome","one_valid_outcome","primary_reports","supplementary_report"],"properties":{"primary_systems":{},"conditional_eligibility":{},"primary_llm_judgments_per_eligible_pair":{},"order_seed":{},"order_algorithm":{},"order_balance":{},"choices":{},"unable_to_assess_action":{},"human_calibration_pair_count":{},"human_calibration_pair_allocation":{},"human_calibration_pair_ordering":{},"both_invalid_outcome":{},"one_valid_outcome":{},"primary_reports":{},"supplementary_report":{}}},
    "measurement":{"type":"object","additionalProperties":false,"required":["binary_interval","paired_difference_interval","paired_difference_direction","bootstrap_binary_unit","bootstrap_continuous_unit","bootstrap_primary_statistics","median_difference_inference","bootstrap_resamples","bootstrap_seed","latency_summaries","token_summaries","quantile_method","subgroup_intervals","missing_attempts_count_as_failures","multiple_comparison_significance_tests"],"properties":{"binary_interval":{},"paired_difference_interval":{},"paired_difference_direction":{},"bootstrap_binary_unit":{},"bootstrap_continuous_unit":{},"bootstrap_primary_statistics":{},"median_difference_inference":{},"bootstrap_resamples":{},"bootstrap_seed":{},"latency_summaries":{},"token_summaries":{},"quantile_method":{},"subgroup_intervals":{},"missing_attempts_count_as_failures":{},"multiple_comparison_significance_tests":{}}},
    "response_similarity":{"type":"object","additionalProperties":false,"required":["reference_collections","primary_exposure_attribution","text_view","calibration_path","lexical_top_k","semantic_top_k","review_is_flag_not_proof","within_system_output_diversity_check","generic_collapse_reported_separately"],"properties":{"reference_collections":{},"primary_exposure_attribution":{},"text_view":{"const":"normalized_field_labelled_complete_schema_content_including_amounts_and_units_or_normalized_complete_raw_output_if_invalid"},"calibration_path":{"const":"data/evaluation/response-similarity-calibration-v1.jsonl"},"lexical_top_k":{},"semantic_top_k":{},"review_is_flag_not_proof":{},"within_system_output_diversity_check":{},"generic_collapse_reported_separately":{}}},
    "authoring":{"type":"object","additionalProperties":false,"required":["requires_frozen_training_and_validation","requires_no_model_training","requires_no_heldout_generation","authoring_order_seed","candidate_collision_replaces","frozen_supervised_data_is_not_rewritten","replacement_reasons","freeze_assets"],"properties":{"requires_frozen_training_and_validation":{},"requires_no_model_training":{},"requires_no_heldout_generation":{},"authoring_order_seed":{},"candidate_collision_replaces":{},"frozen_supervised_data_is_not_rewritten":{},"replacement_reasons":{},"freeze_assets":{}}}
  },
  "allOf":[
    {"if":{"properties":{"status":{"const":"review_candidate"}}},"then":{"properties":{"freeze_gate":{"properties":{"review_id":{"type":"null"},"reviewer_identity":{"type":"null"},"review_verdict":{"type":"null"},"unresolved_blocking_findings":{"type":"null"},"frozen_at_utc":{"type":"null"},"review_artifact_path":{"type":"null"},"review_artifact_sha256":{"type":"null"},"verification_evidence_path":{"type":"null"},"verification_evidence_sha256":{"type":"null"},"transition_orchestrator_sha256":{"type":"null"}}}}}},
    {"if":{"properties":{"status":{"const":"frozen"}}},"then":{"properties":{"freeze_gate":{"properties":{"review_id":{"type":"string","pattern":"\\S"},"reviewer_identity":{"type":"string","pattern":"\\S"},"review_verdict":{"const":"pass"},"unresolved_blocking_findings":{"const":0},"frozen_at_utc":{"type":"string","format":"date-time"},"review_artifact_path":{"type":"string","pattern":"\\S"},"review_artifact_sha256":{"type":"string","pattern":"^[0-9a-f]{64}$"},"verification_evidence_path":{"type":"string","pattern":"\\S"},"verification_evidence_sha256":{"type":"string","pattern":"^[0-9a-f]{64}$"},"transition_orchestrator_sha256":{"type":"string","pattern":"^[0-9a-f]{64}$"}}}}}}
  ]
}
