{"authoring":{"authoring_order_seed":20260715,"candidate_collision_replaces":"heldout_candidate","freeze_assets":["prompts","metadata","prompt_collision_reports","replacement_log","source_identities","canonical_source_records","withheld_domain_checks","authoring_schedule","semantic_review_artifact","pair_order_schedule","reviewed_protocol_manifest","heldout_freeze_bundle"],"frozen_supervised_data_is_not_rewritten":true,"replacement_reasons":["scope_or_answerability","quota_or_metadata","exact_collision","semantic_scenario_collision","withheld_domain_violation","internal_heldout_collision","ambiguous_or_unscorable"],"requires_frozen_training_and_validation":true,"requires_no_heldout_generation":true,"requires_no_model_training":true},"contamination":{"exact_normalized_match_action":"automatic_reject_with_second_review","lexical":{"algorithm":"rapidfuzz.fuzz.token_ratio","library":"rapidfuzz","license":"MIT","top_k":5,"version":"3.14.5"},"metadata":{"fields":["topic","user_goal","requested_task_or_artefact","scenario_summary","important_constraints"],"top_k":5},"normalization":"unicode_nfc_casefold_line_endings_whitespace_v1","reject_when":"all_three_review_answers_yes","review":{"accepted_audit_fraction":0.1,"accepted_audit_selection":"six_lowest_sha256_of_contamination-audit-v1_pipe_20260715_pipe_preassigned_matrix_prompt_id","retain_all_rationales":true,"second_review_for":["reject","uncertain"],"second_reviewer_blind_to_first_decision":true,"unresolved_action":"reject_and_replace"},"semantic":{"dimensions":384,"license":"Apache-2.0","maximum_wordpieces":256,"model_id":"sentence-transformers/all-MiniLM-L6-v2","normalization":"l2","pooling":"attention_masked_mean_of_last_hidden_state","record_pre_truncation_wordpieces":true,"record_truncation_flag":true,"revision":"1110a243fdf4706b3f48f1d95db1a4f5529b4d41","similarity":"cosine","top_k":5,"truncated_input_action":"manual_complete_text_review"},"semantic_review_questions":["same_user_goal","same_substantive_situation_concept_source_or_artefact","substantive_answer_reusable_with_surface_changes"],"source_collections":["worked_examples","prompt_development","evaluation_calibration","training","validation","accepted_heldout_candidates","rejected_heldout_candidates"]},"contamination_calibration_path":"data/evaluation/contamination-calibration-v1.jsonl","documentation_paths":["docs/stage-3-evaluation-protocol.md","docs/evaluation-population.md","docs/similarity-tooling-selection.md","docs/unseen-contamination-protocol.md","docs/qualitative-evaluation-protocol.md","docs/blind-pairwise-protocol.md","docs/evaluation-analysis-protocol.md","docs/response-similarity-protocol.md","docs/heldout-authoring-protocol.md"],"evaluation_generation_manifest_schema_path":"schemas/evaluation-generation-manifest-v1.schema.json","freeze_gate":{"frozen_at_utc":"2026-07-15T16:03:26.290164Z","independent_review_required":true,"review_artifact_path":"reviews/stage3-review-final-20260715.json","review_artifact_sha256":"c1a6239ee4d096f2118fe11a3df0c14a40eb41e87bb6134b86edc810466b8b5a","review_id":"stage3-review-v1-final-20260715","review_verdict":"pass","reviewer_identity":"codex-review-cycle-final-assessment","transition_orchestrator_sha256":"526ff36a237b946628727b9092688ea1eb5be78f688aa7f9c9ad8554e864f5b7","unresolved_blocking_findings":0,"verification_evidence_path":"reviews/stage3-verification-final-20260715.json","verification_evidence_sha256":"8eca97779815991b2615927d443bfeea049de13c094d29a0a4fcef1a284bc47c"},"heldout_freeze_bundle_schema_path":"schemas/heldout-freeze-bundle-v1.schema.json","heldout_prompt_schema_path":"schemas/heldout-prompt-v1.schema.json","heldout_replacement_schema_path":"schemas/heldout-replacement-v1.schema.json","judge_calibration_path":"data/evaluation/judge-calibration-v1.jsonl","judge_manifest_path":"config/judge-manifest-v1.json","judging":{"agreement_statistics":["exact_score_agreement","binary_acceptability_agreement","weighted_cohens_kappa"],"human_and_llm_results_reported_separately":true,"human_calibration_pair_count":15,"human_calibration_response_allocation":"up_to_two_per_system_slice_then_same_system_hash_fill_to_six_no_cross_system_fill","human_calibration_response_count":24,"human_calibration_response_ordering":"sha256_of_human-response-calibration-v1_pipe_20260715_pipe_packet_id","human_calibration_selection_seed":20260715,"llm_unable_to_assess_action":"second_blinded_judgment","no_automatic_agreement_threshold":true,"primary_llm_judgments_per_eligible_response":1,"qualitative_eligibility":"schema_valid_only","second_unable_to_assess_action":"unresolved_excluded_from_resolved_dimension_rate_and_fails_joint_pass"},"measurement":{"binary_interval":"wilson_95","bootstrap_binary_unit":"all_60_prompt_ids_with_B_and_C_values_kept_paired","bootstrap_continuous_unit":"achieved_matched_prompt_ids_only","bootstrap_primary_statistics":["paired_rate_difference","paired_mean_difference"],"bootstrap_resamples":10000,"bootstrap_seed":20260715,"latency_summaries":["count","mean","median","standard_deviation","interquartile_range"],"median_difference_inference":"descriptive_only","missing_attempts_count_as_failures":true,"multiple_comparison_significance_tests":false,"paired_difference_direction":"C_minus_B","paired_difference_interval":"paired_nonparametric_bootstrap_percentile_95","quantile_method":"linear_type7","subgroup_intervals":false,"token_summaries":["count","mean","median","interquartile_range"]},"pairwise":{"both_invalid_outcome":"both_failed","choices":["response_a","response_b","tie"],"conditional_eligibility":"both_schema_valid","human_calibration_pair_allocation":"up_to_five_per_slice_then_global_hash_fill_to_fifteen","human_calibration_pair_count":15,"human_calibration_pair_ordering":"sha256_of_human-pair-calibration-v1_pipe_20260715_pipe_prompt_id","one_valid_outcome":"schema_valid_response_wins","order_algorithm":"sort_by_sha256_of_pairwise-order-v1_pipe_20260715_pipe_prompt_id_then_first_30_B_first","order_balance":{"B_first":30,"C_first":30},"order_seed":20260715,"primary_llm_judgments_per_eligible_pair":1,"primary_reports":["B_win_rate","C_win_rate","tie_rate"],"primary_systems":["B","C"],"supplementary_report":"decisive_comparisons_only_preference","unable_to_assess_action":"second_blinded_judgment_then_unresolved"},"pairwise_judgment_schema_path":"schemas/pairwise-judgment-v1.schema.json","prompt_overlap_review_schema_path":"schemas/prompt-overlap-review-v1.schema.json","protocol_id":"chatgnt-evaluation-v1","protocol_manifest_path":"config/evaluation-protocol-manifest-v1.json","protocol_schema_path":"schemas/evaluation-protocol-v1.schema.json","qualitative_judgment_schema_path":"schemas/qualitative-judgment-v1.schema.json","qualitative_rubric_path":"config/evaluation-rubric-v1.json","response_similarity":{"calibration_path":"data/evaluation/response-similarity-calibration-v1.jsonl","generic_collapse_reported_separately":true,"lexical_top_k":5,"primary_exposure_attribution":{"A":[],"B":["worked_example_responses"],"C":["training_responses"],"D":["worked_example_responses","training_responses"]},"reference_collections":["worked_example_responses","training_responses"],"review_is_flag_not_proof":true,"semantic_top_k":5,"text_view":"normalized_field_labelled_complete_schema_content_including_amounts_and_units_or_normalized_complete_raw_output_if_invalid","within_system_output_diversity_check":true},"response_similarity_calibration_path":"data/evaluation/response-similarity-calibration-v1.jsonl","response_similarity_evidence_schema_path":"schemas/response-similarity-evidence-v1.schema.json","response_similarity_review_schema_path":"schemas/response-similarity-review-v1.schema.json","review_artifact_schema_path":"schemas/stage3-review-artifact-v1.schema.json","sample":{"complexity":{"composed":20,"standard":40},"composed_non_robustness_per_intent_family":1,"composed_per_intent_family":4,"composed_robustness":15,"constraint_bearing":10,"constraint_bearing_per_intent_family":2,"input_forms":{"direct_request_or_command":30,"question":15,"statement_or_fragment":15},"intent_family_each":12,"prompt_count":60,"reporting_slices":{"cross_domain":15,"robustness":15,"target_use":30},"robustness_roles":{"behaviour_pressure":5,"format_pressure":5,"serialization_pressure":5}},"schema_version":1,"source_identity_schema_path":"schemas/source-identity-v1.schema.json","stage3_verification_evidence_schema_path":"schemas/stage3-verification-evidence-v1.schema.json","stage5_semantic_review_schema_path":"schemas/stage5-semantic-review-v1.schema.json","status":"frozen","withheld_domain_check_schema_path":"schemas/withheld-domain-check-v1.schema.json","withheld_domains":{"domains":["photography","tabletop_games","pottery_ceramics"],"prohibited_project_collections":["worked_examples","prompt_development","evaluation_calibration","training","validation"],"prompts_per_domain":5,"prompts_per_intent_family_domain_pair":1}}
